{
  "schemaVersion": "resume-resolution.v1",
  "resolutionId": "resume-md-remapped",
  "progressId": "progress-md-stale",
  "sourceId": "contract-markdown",
  "requestedAt": "2026-05-17T01:20:01Z",
  "decision": "auto_resume_remapped",
  "reason": "stale progress remapped through repair revision map with high confidence",
  "resolvedReadalongManifestId": "ram-md-002",
  "resolvedLocatorEnvelope": {
    "schemaVersion": "locator-envelope.v1",
    "kind": "resume",
    "sourceId": "contract-markdown",
    "nodeId": "md-0001",
    "scopeKey": "document",
    "activeWordIndex": 1,
    "locator": {
      "type": "markdown",
      "markdown": {
        "path": "contract.md",
        "lineStart": 3,
        "lineEnd": 3,
        "columnStart": 1,
        "columnEnd": 28,
        "astPath": "/children/1"
      }
    },
    "textQuote": "Doctor Nguyen shipped version one."
  },
  "revisionMapId": "revmap-md-001",
  "staleProgressId": "progress-md-stale"
}
